97,Other,read TV channel/program information,com.android.providers.tv.permission.READ_EPG_DATA,,395,,Allows an application to read (but not write) its own TV channel/program data,"For apps running on Android TV, needs explanation","TV (streaming) app? TV streaming recording app?
Your TV input must provide Electronic Program Guide (EPG) data for at least one channel in its setup activity. You should also periodically update that data, with consideration for the size of the update and the processing thread that handles it.
https://developer.android.com/training/tv/tif/channel
The READ_EPG_DATA permission was deprecated in Android M (API 23) and is no longer needed."
98,Other,write TV channel/program information,com.android.providers.tv.permission.WRITE_EPG_DATA,,395,,Allows an application to write (but not read) its own TV channel/program data.,"For apps running on Android TV, needs explanation","TV (streaming) app? TV streaming recording app?
In order for your TV input to work with EPG data, it must declare the write permission in its Android manifest file.
https://developer.android.com/training/tv/tif/channel"
99,Other,bind to a notification listener service,android.permission.BIND_NOTIFICATION_LISTENER_SERVICE,,241,Yes,Allows the holder to bind to the top-level interface of a notification listener service. Should never be needed for normal apps.,Need explanation,"Protection level: signature
A service that receives calls from the system when new notifications are posted or removed, or their ranking changed, receive notifications from other apps, such as when a new message is received
https://developer.android.com/reference/android/service/notification/NotificationListenerService
https://blog.csdn.net/u013512708/article/details/105702874
https://cloud.tencent.com/developer/article/2162726"
100,Other,delete apps,android.permission.DELETE_PACKAGES,,177,Yes,Allows the app to delete Android packages. Malicious apps may use this to delete important apps.,Need explanation even for System app; security; cleaner,"Not for use by third-party applications.
"
101,Phone,add voicemail,com.android.voicemail.permission.ADD_VOICEMAIL,,82,,Allows the app to add messages to your voicemail inbox.,voicemail app; others: need explanation,
102,Contacts,modify your contacts,android.permission.WRITE_CONTACTS,,4738,,"Allows the app to modify the data about your contacts stored on your phone, including the frequency with which you\'ve called, emailed, or communicated in other ways with specific contacts. This permission allows apps to delete contact data.","Phone, Message, Email, System; others need explanation - social media app, backup contact",
103,SMS,read your text messages (SMS or MMS),android.permission.READ_SMS,,439,,"Allows the app to read SMS messages stored on your phone or SIM card. This allows the app to read all SMS messages, regardless of content or confidentiality.","Need explanation - messaging app, security app, backup app
e.g., needing to read one-time password","Reading one-time password
May access sensitive information 
https://support.google.com/googleplay/android-developer/answer/10208820?hl=zh-HK
Read all SMS.If read specific SM?there is another permission can do it
https://juejin.cn/s/android%20%E8%AF%BB%E5%8F%96%E7%9F%AD%E4%BF%A1%E6%9D%83%E9%99%90"
104,Phone,read call log,android.permission.READ_CALL_LOG,,572,,"Allows the app to read your phone\'s call log, including data about incoming and outgoing calls. This permission allows apps to save your call log data, and malicious apps may share call log data without your knowledge.",spam blocking app; others - need explanation,
105,SMS,receive text messages (SMS),android.permission.RECEIVE_SMS,,444,,Allows the app to receive and process SMS messages. This means the app could monitor or delete messages sent to your device without showing them to you.,"Need explanation - e.g. spam blocking app, security app, back up app",
106,Other,read frame buffer,android.permission.READ_FRAME_BUFFER,,47,Yes,Allows the app to read the content of the frame buffer.,"Need explaination - video, multimedia, screen","either signature or privileged permissions
(ref: https://source.android.com/docs/core/permissions/restricted-screen-reading)
Object that enables rendering into a HardwareBuffer by creating a frame buffer object from it by leveraging Android specific EGL extensions to create an EGLImageKHR object that is loaded as a texture.
https://developer.android.com/reference/androidx/graphics/opengl/FrameBuffer
For screen capture, can use MediaProjection and declare android.permission.MANAGE_MEDIA_PROJECTION"
107,SMS,receive text messages (MMS),android.permission.RECEIVE_MMS,,116,,Allows the app to receive and process MMS messages. This means the app could monitor or delete messages sent to your device without showing them to you.,"Need explanation, e.g., spam blocking app,security app, back up app",
108,SMS,send SMS messages,android.permission.SEND_SMS,,311,,Allows the app to send SMS messages. This may result in unexpected charges. Malicious apps may cost you money by sending messages without your confirmation.,"Need explanation, e.g., messaging (SMS) app",
109,SMS,edit your text messages (SMS or MMS),android.permission.WRITE_SMS,,147,,Allows the app to write to SMS messages stored on your phone or SIM card. Malicious apps may delete your messages.,"Need explanation - edit or remove message, restore message",
110,Phone,directly call any phone numbers,android.permission.CALL_PRIVILEGED,,55,Yes,"Allows the app to call any phone number, including emergency numbers, without your intervention. Malicious apps may place unnecessary and illegal calls to emergency services.",Need explanation - making phone call,Not for use by third-party applications.
111,Phone,write call log,android.permission.WRITE_CALL_LOG,,141,,"Allows the app to modify your phone\'s call log, including data about incoming and outgoing calls. Malicious apps may use this to erase or modify your call log.","Spam-filtering (phone-call); others need explanation - e.g., privacy app, security app","A smartwatch app does not need the WRITE_CALL_LOG permission. There is no use case for a smartwatch app to write to the call log. If you see an app requesting this permission, it is likely a malicious app and you should not install it. (Google-PaLM)"
112,Phone,reroute outgoing calls,android.permission.PROCESS_OUTGOING_CALLS,,145,,"Allows the app to process outgoing calls and change the number to be dialed. This permission allows the app to monitor, redirect, or prevent outgoing calls.",need explanation - reroute call,"modify or block outgoing calls
Prior to Android 10 (API level 29), an app that blocks incoming spam calls typically requires the android.permission.PROCESS_OUTGOING_CALLS permission to effectively perform call blocking (ChatGPT / Google-PaLM)
An app does not need the android.permission.PROCESS_OUTGOING_CALLS permission for the notification of incoming calls."
113,Phone,modify phone state,android.permission.MODIFY_PHONE_STATE,,219,Yes,"Allows the app to control the phone features of the device. An app with this permission can switch networks, turn the phone radio on and off and the like without ever notifying you.",need explanation,"Not for use by third-party applications.
App needs this permission to setup call forwarding (PoE and Google-PaLM)
APN on/off; Silent mode on/off; Vibrate mode; Airplane mode on/off; Auto-Sync on/off; Brightness; Screen out time; Auto rotate on/off; Audible touch tones on/off; Screen lock sounds on/off; Haptic feedback on/off; Stay awake on charging on/off; Screen lock security on/off; Visible lock pattern on/off; Skip slide lock on/off"
114,Photos/Media/Files,erase USB storage,android.permission.MOUNT_FORMAT_FILESYSTEMS,,46,Yes,Allows the app to format removable storage.,need explanation,"Not for use by third-party applications.
E.g., security; privacy; need explanation
An app that helps remove duplicate files does not need the android.permission.MOUNT_FORMAT_FILESYSTEMS permission.
This permission is required for actions such as formatting the SD card or installing a new operating system."
115,Other,record what you type and actions you take,android.permission.READ_INPUT_STATE,,14,Yes,Allows the app to watch the keys you press even when interacting with another app (such as typing a password). Should never be needed for normal apps.,need explanation,Not for use by third-party applications. Deprecated in API level 16
116,Other,read sync statistics,android.permission.READ_SYNC_STATS,,782,,"Allows an app to read the sync stats for an account, including the history of sync events and how much data is synced.","need explanation - e.g., account management, file management, contact management (similar to 85 and 86)","Probably needed for apps that track data usage / analysis
It's important to note that this permission is not required for an app to perform synchronization itself. Apps can use the SyncManager class to initiate and manage synchronization without needing the android.permission.READ_SYNC_STATS permission. However, if an app needs to access information about its own sync status or monitor the progress of sync operations, it will need to request the android.permission.READ_SYNC_STATS permission."
117,Other,modify global animation speed,android.permission.SET_ANIMATION_SCALE,,16,Yes,Allows the app to change the global animation speed (faster or slower animations) at any time.,need explanation - animation speed,"Not for use by third-party applications.
System setting / usability app"
118,Identity,modify your own contact card,android.permission.WRITE_PROFILE,,122,,"Allows the app to change or add to personal profile information stored on your device, such as your name and contact information. This means the app can identify you and may send your profile information to others.","social media, messaging, bank; others - need explanation",The android.permission.WRITE_PROFILE permission is a sensitive permission that allows an app to write to the user's profile data. It is typically used by specific system or profile management apps rather than regular consumer apps. (ChatGPT)
119,Other,Send download notifications.,android.permission.SEND_DOWNLOAD_COMPLETED_INTENTS,,88,,Allows the app to send notifications about completed downloads. Malicious apps can use this to confuse other apps that download files.,"streaming app,video app,audio app, need explanation",
120,Other,capture video output,android.permission.CAPTURE_VIDEO_OUTPUT,,256,Yes,Allows the app to capture and redirect video output,need explanation - capture video,"Not for use by third-party applications.
May be needed by screen-sharing app, but not a video-chat app (ChatGPT)
Prior to Android 10, the CAPTURE_VIDEO_OUTPUT permission was required for a third-party screen-sharing app to capture the video output of the screen. However, starting with Android 10, the CAPTURE_VIDEO_OUTPUT permission is no longer required for screen-sharing apps. (Google-PaLM)"
121,Other,delete all app cache data,android.permission.CLEAR_APP_CACHE,,652,Yes,Allows the app to free phone storage by deleting files in the cache directories of other applications. This may cause other applications to start up more slowly as they need to re-retrieve their data.,need explanation - remove / clean,"Protection level: signature|privileged
Allows an application to clear the caches of all installed applications on the device."
122,Other,transmit infrared,android.permission.TRANSMIT_IR,,488,,Allows the app to use the phone's infrared transmitter.,"control-type app (TV, multimedia device); others need explanation",
123,Other,allow Bluetooth pairing by Application,android.permission.BLUETOOTH_PRIVILEGED,,396,Yes,Allows the app to pair with remote devices without user interaction.,"need explanation, e.g., bluetooth device menufacturer's app",Not for use by third-party applications.
124,Other,Interact with update and recovery system,android.permission.RECOVERY,,10,Yes,Allows an application to do certain operations needed for interacting with the recovery (system update) system.,need explanation - system backup and recovery,
125,Other,set time,android.permission.SET_TIME,,37,Yes,Allows the app to change the phone\'s clock time.,need explanation,Not for use by third-party applications.
126,Other,set time zone,android.permission.SET_TIME_ZONE,,109,Yes,Allows the app to change the phone\'s time zone.,need explanation,Not for use by third-party applications.
127,Other,delete other apps' data,android.permission.CLEAR_APP_USER_DATA,,112,Yes,Allows the app to clear user data.,need explanation - remove / clean,privacy / security / cleaner
128,Other,modify secure system settings,android.permission.WRITE_SECURE_SETTINGS,,451,Yes,Allows the app to modify the system\'s secure settings data. Not for use by normal apps.,need explanation,"Not for use by third-party applications.
change the value of a secure setting, such as the screen lock pattern or the device administrator password. (Google PaLM)
Enterprise Device Management (ChatGPT on PoE)"
129,Other,choose widgets,android.permission.BIND_APPWIDGET,,195,Yes,Allows the app to tell the system which widgets can be used by which app. An app with this permission can give access to personal data to other apps. Not for use by normal apps.,need explanation - e.g. homescreen UI setup,"Not for use by third-party applications.
https://developer.android.com/develop/ui/views/appwidgets
App Widgets are small, interactive components that can be displayed on the home screen or other designated areas of an Android device"
130,Other,Access keyguard secure storage,android.permission.ACCESS_KEYGUARD_SECURE_STORAGE,,27,Yes,Allows an application to access keguard secure storage.,need explanation - secure storage,"This permission is required if an application wants to access the keyguard secure storage, such as to store sensitive data that should only be accessible when the device is unlocked. (Google-PaLM)
Secure Credential Storage"
131,Other,bind to a wallpaper,android.permission.BIND_WALLPAPER,,27,Yes,Allows the holder to bind to the top-level interface of a wallpaper. Should never be needed for normal apps.,"need explanation - bind wallpaper, change wallpaper, manipulate wallpaper","Protection level: signature|privileged
This permission is required if an application wants to set the wallpaper or to access the wallpaper service. (Google-PaLM)
The BIND_WALLPAPER permission is a system-level permission that allows an app to act as a live wallpaper service. (ChatGPT)
Live video wallpaper apps are designed to provide dynamic and animated wallpapers that display videos or moving images on the device's home screen or lock screen. By requesting the BIND_WALLPAPER permission, the app can function as a live wallpaper service and provide the necessary functionality to set and display live video wallpapers. (ChatGPT)
Theme app, launcher app, or ordinary wallpaper app do not need this permission."
132,Other,enable or disable app components,android.permission.CHANGE_COMPONENT_ENABLED_STATE,,56,Yes,"Allows the app to change whether a component of another app is enabled or not. Malicious apps may use this to disable important phone capabilities. Care must be used with this permission, as it is possible to get app components into an unusable, inconsistent, or unstable state.",need explanation - enable or disable a system service / component of another application ,Not for use by third-party applications.
133,Other,force stop other apps,android.permission.FORCE_STOP_PACKAGES,,45,Yes,Allows the app to forcibly stop other apps.,"need explanation - cleaner, security, resource management, etc.",
134,Other,status bar,android.permission.STATUS_BAR_SERVICE,,33,Yes,Allows the app to be the status bar.,need explanation - status bar,"This permission is required if an application wants to access the status bar service, such as to get the status bar height or to change the status bar color. (Google-PaLM)"
135,Other,modify app ops statistics,android.permission.UPDATE_APP_OPS_STATS,,94,Yes,Allows the app to modify collected application operation statistics. Not for use by normal apps.,Need explanation - update statistics,"https://forum.xda-developers.com/t/issues-with-granting-system-app-update_app_ops_stats-permission.3386965/
APP OPS STAT: e.g., the number of times an application has been launched or the amount of time an application has been in use.
App-ops are used for two purposes: Access control and tracking.
App-ops cover a wide variety of functionality from helping with runtime permissions access control and tracking to battery consumption tracking.
https://developer.android.com/reference/android/app/AppOpsManager"
136,Other,limit number of running processes,android.permission.SET_PROCESS_LIMIT,,28,Yes,Allows the app to control the maximum number of processes that will run. Never needed for normal apps.,need explanation - resource management,Not for use by third-party applications.
137,Other,set preferred apps,android.permission.SET_PREFERRED_APPLICATIONS,,20,Yes,"Allows the app to modify your preferred apps. Malicious apps may silently change the apps that are run, spoofing your existing apps to collect private data from you.","need explanation - e,g, custom application launcher",Deprecated in API level 15
138,Other,add words to user-defined dictionary,android.permission.WRITE_USER_DICTIONARY,,293,,Allows the app to write new words into the user dictionary.,"need explanation, e.g., input/keyboard",
139,Other,access all TV channel/program information,com.android.providers.tv.permission.ACCESS_ALL_EPG_DATA,,19,,Allows an application to read and write all TV channel/program data,"For apps running on Android TV, needs explanation",
140,Other,Access email provider data,com.android.email.permission.ACCESS_PROVIDER,,41,,"Allows this application to access your email database, including received messages, sent messages, usernames, and passwords.",need explanation - read / write email,"This can enable features like email notifications, searching through emails, or creating tasks or reminders based on email content. (ChatGPT)"
141,Other,Read email attachments,com.android.email.permission.READ_ATTACHMENT,,87,,Allows this application to read your email attachments.,need explanation - read / write email attachment,"This permission is required if an application wants to read email attachments, such as to view an attached image or to open an attached document. (Google-PaLM)"
142,Other,Access all system downloads,android.permission.ACCESS_ALL_DOWNLOADS,,143,,Allows the app to view and modify all downloads initiated by any app on the system.,"file manager, download manager; others - need explanation",
143,Other,read subscribed feeds,android.permission.SUBSCRIBED_FEEDS_READ,,81,,Allows the app to get details about the currently synced feeds.,"need explanation - feeds (display, aggregate)","News Aggregator App (ChatGPT)
To display the latest headlines from a user's subscribed feeds"
144,Other,add or remove a device admin,android.permission.MANAGE_DEVICE_ADMIN,,39,,Allows the holder to add or remove active device administrators. Should never be needed for normal apps.,need explanation - device management,"Enterprise Device Management (ChatGPT)
This permission is required if an application wants to manage device administrators, such as to enable or disable a device administrator or to reset a device administrator's password. (Google-PaLM)

If an app wants to lock the screen using custom tap or swipe gestures, it typically requires the android.permission.MANAGE_DEVICE_ADMIN permission.

The android.permission.MANAGE_DEVICE_ADMIN permission is a system-level permission that allows an app to manage device administration features, including the ability to lock the screen, set password policies, and perform other device management tasks.

By requesting the MANAGE_DEVICE_ADMIN permission and becoming a registered device administrator, a security app can perform actions like remotely locking the device, enforcing security policies, and providing anti-theft features. These functionalities require elevated privileges to ensure the app can effectively carry out its security-related tasks. (PoE)"
145,Other,bind to an accessibility service,android.permission.BIND_ACCESSIBILITY_SERVICE,,222,Yes,Allows the holder to bind to the top-level interface of an accessibility service. Should never be needed for normal apps.,need explanation - accessibility,"Protection level: signature
To interact with an accessibility service, such as to provide accessibility features for users with disabilities. (Google-PaLM)

The BIND_ACCESSIBILITY_SERVICE permission allows an app to register as an accessibility service, which grants it the necessary access to monitor and interact with the user interface of other apps. Call recording typically involves capturing audio during phone calls, which may require monitoring and interacting with the phone app's user interface. (PoE)"
146,Other,access external storage of all users,android.permission.ACCESS_ALL_EXTERNAL_STORAGE,,8,,Allows the app to access external storage for all users.,need explanation - external storage,"This permission is required if an application wants to access all external storage devices, such as to read files from an SD card or to write files to an SD card. (Google-PaLM)"
147,Other,get current app info,android.permission.GET_TOP_ACTIVITY_INFO,,18,Yes,Allows the holder to retrieve private information about the current application in the foreground of the screen.,need explanation,"Task Management or Automation; This permission provides access to details about the currently visible activity, such as its package name, class name, and other relevant information. (ChatGPT)"
148,Other,control system backup and restore,android.permission.BACKUP,,16,Yes,Allows the app to control the system\'s backup and restore mechanism. Not for use by normal apps.,need explanation - backup and restore,
149,Other,write subscribed feeds,android.permission.SUBSCRIBED_FEEDS_WRITE,,97,,Allows the app to modify your currently synced feeds. Malicious apps may change your synced feeds.,need explanation - update subscribed feed,
150,Other,capture audio output,android.permission.CAPTURE_AUDIO_OUTPUT,,305,Yes,Allows the app to capture and redirect audio output.,"need explanation - e.g., phone call recorder, redirect to another audio device, broadcast","Not for use by third-party applications.
Capture the voice call
https://blog.csdn.net/tq501501/article/details/117085659"
151,Other,capture secure video output,android.permission.CAPTURE_SECURE_VIDEO_OUTPUT,,65,Yes,Allows the app to capture and redirect secure video output.,need explanation - screen recording  with DRM support (protecte by DRM),"either signature or privileged permissions
(ref: https://source.android.com/docs/core/permissions/restricted-screen-reading)"
152,Other,access SurfaceFlinger,android.permission.ACCESS_SURFACE_FLINGER,,31,Yes,Allows the app to use SurfaceFlinger low-level features.,need explanation - user interface,"provides direct access to the Surface Flinger service, which is responsible for compositing and rendering the user interface on Android devices (ChatGPT)
to create a new surface or to change the properties of a surface (Google-PaLM)

Apps that require the android.permission.ACCESS_SURFACE_FLINGER permission typically fall into the following categories:

1. Screen Recording Apps: Apps that record the device's screen, such as screencasting or game recording apps, require this permission to access the SurfaceFlinger service, which manages the composition and display of graphics on the screen. This permission allows these apps to capture the visual content being displayed on the screen and record it as a video.

2. Live Wallpaper Apps: Live wallpapers are animated or interactive wallpapers that run on the device's home screen. To function properly, live wallpaper apps need access to the SurfaceFlinger service to render and display their animations or interactive elements on the screen.

3. Virtual Reality (VR) and Augmented Reality (AR) Apps: VR and AR apps often require low-latency access to the display to provide immersive experiences. The android.permission.ACCESS_SURFACE_FLINGER permission allows these apps to bypass the normal graphics pipeline and directly interact with the SurfaceFlinger service, reducing latency and improving the overall VR/AR experience.

4. Screen Mirroring Apps: Apps that enable screen mirroring or casting to external displays, such as TVs or projectors, require this permission to access the SurfaceFlinger service and capture the device's screen content for mirroring purposes.

5. Accessibility Services: Some accessibility services may need this permission to modify the visual output of the device's screen, such as applying color filters or magnifications, to assist users with visual impairments.

It's important to note that this permission is considered a high-risk permission, as it allows an app to bypass the normal security mechanisms that protect the device's display."
153,Other,press keys and control buttons,android.permission.INJECT_EVENTS,,73,Yes,"Allows the app to deliver its own input events (key presses, etc.) to other apps. Malicious apps may use this to take over the phone.",need explanation - e.g. app testing,"Automated Testing Tools; simulate user input events, such as touch, keypress, or motion events, to interact with the device and test application behavior. (ChatGPT)"
