233,Other,bind to a text service,android.permission.BIND_TEXT_SERVICE,,4,Yes,Allows the holder to bind to the top-level interface of a text service(e.g. SpellCheckerService). Should never be needed for normal apps.,need explanation - text-related,Protection level: signature
234,Other,access checkin properties,android.permission.ACCESS_CHECKIN_PROPERTIES,,44,Yes,Allows the app read/write access to properties uploaded by the checkin service. Not for use by normal apps.,need explanation - checkin,"Not for use by third-party applications.
checkin ID / status"
235,Other,bind to a voice interactor,android.permission.BIND_VOICE_INTERACTION,,12,Yes,Allows the holder to bind to the top-level interface of a voice interaction service. Should never be needed for normal apps.,need explanation - voice assistant,"Protection level: signature
can bind to the voice interaction service and intercept voice commands given by the user (ChatGPT)"
236,Other,read phone status and identity,android.permission.READ_PHONE_STATE,,2,,"Allows the app to access the phone features of the device. This permission allows the app to determine the phone number and device IDs, whether a call is active, and the remote number connected by a call.","explanation - authentication tied with a phone / number (same as 28,29)",
237,Other,control location update notifications,android.permission.CONTROL_LOCATION_UPDATES,,53,Yes,Allows the app to enable/disable location update notifications from the radio. Not for use by normal apps.,need explanation - control location update,"Not for use by third-party applications.
to control location updates, such as to start or stop location updates or to change the location update interval (Google-PaLM)"
238,Other,interact with in-call screen,android.permission.BIND_CALL_SERVICE,,4,,Allows the app to control when and how the user sees the in-call screen.,need explanation - call screen,
239,Other,bind to an input method,android.permission.BIND_INPUT_METHOD,,13,Yes,Allows the holder to bind to the top-level interface of an input method. Should never be needed for normal apps.,need explanation - input method,"Protection level: signature
to provide alternative input methods for text entry. (ChatGPT)
to get the current input method or to change the input method (Google-PaLM)"
240,Other,directly call phone numbers,android.permission.CALL_PHONE,,1,,Allows the app to call phone numbers without your intervention. This may result in unexpected charges or calls. Note that this doesn\'t allow the app to call emergency numbers. Malicious apps may cost you money by making calls without your confirmation.,Security / safety apps (notify someone),
241,Other,bind to NFC service,android.permission.BIND_NFC_SERVICE,,15,Yes,Allows the holder to bind to applications that are emulating NFC cards. Should never be needed for normal apps.,need explanation - NFC,Protection level: signature
242,Other,send Linux signals to apps,android.permission.SIGNAL_PERSISTENT_PROCESSES,,15,Yes,Allows the app to request that the supplied signal be sent to all persistent processes.,need explanation - app management,Not for use by third-party applications.
243,Other,force background apps to close,android.permission.SET_ALWAYS_FINISH,android.permission.KILL_BACKGROUND_PROCESSES,10,Yes,Allows the app to control whether activities are always finished as soon as they go to the background. Never needed for normal apps.,"cleaner, security, privacy; others need explanation",Not for use by third-party applications.
244,Other,force app to close,android.permission.FORCE_BACK,,7,Yes,Allows the app to force any activity that is in the foreground to close and go back. Should never be needed for normal apps.,"cleaner, security, privacy; others need explanation",
245,Other,move app resources,android.permission.MOVE_PACKAGE,,4,Yes,Allows the app to move app resources from internal to external media and vice versa.,app management; cleaner; others: need explanation,
246,Other,copy content,android.permission.COPY_PROTECTED_DATA,,2,Yes,copy content,need explanation - backup and recovery,
247,Other,find accounts on the device,android.permission.GET_ACCOUNTS,,2,,Allows the app to get the list of accounts known by the phone. This may include any accounts created by applications you have installed.,All ok with reasonable description (Check 16),
248,Other,read/write to resources owned by diag,android.permission.DIAGNOSTIC,,7,Yes,"Allows the app to read and write to any resource owned by the diag group; for example, files in /dev. This could potentially affect system stability and security. This should be ONLY be used for hardware-specific diagnostics by the manufacturer or operator.",need explanation - device management,Not for use by third-party applications.
249,Other,read your contacts,android.permission.READ_CONTACTS,,1,,"Allows the app to read data about your contacts stored on your phone, including the frequency with which you\'ve called, emailed, or communicated in other ways with specific individuals. This permission allows apps to save your contact data, and malicious apps may share contact data without your knowledge.","Need to specify ""contact list"" (check 45)",
250,Other,access DRM certificates,android.permission.ACCESS_DRM_CERTIFICATES,,3,Yes,Allows an application to provision and use DRM certficates. Should never be needed for normal apps.,need explanation - DRM,retrieve DRM certificates associated with the user's account or subscription. use these certificates to decrypt and play DRM-protected content securely on the device. (ChatGPT)
251,Other,access notifications,android.permission.ACCESS_NOTIFICATIONS,,19,Yes,"Allows the app to retrieve, examine, and clear notifications, including those posted by other apps.",need explanation - notification management,"access the notifications from various apps and perform actions such as grouping, filtering, prioritizing, or dismissing notifications. offer features like notification history, custom notification categories, or advanced notification settings (ChatGPT)"
252,Other,interact with telephony services,android.permission.BIND_TELECOM_CONNECTION_SERVICE,,1,Yes,"Must be required by a ConnectionService, to ensure that only the system can bind to it.",need explanation - telephony services,"Protection level: signature|privileged
can access and utilize the telecom connection service's functionality to record phone calls in a reliable and consistent manner (ChatGPT)"
253,Other,bind to a widget service,android.permission.BIND_APPWIDGET,,12,Yes,Allows the app to tell the system which widgets can be used by which app. An app with this permission can give access to personal data to other apps. Not for use by normal apps.,need explanation - app widget control / management,Not for use by third-party applications.
254,Other,bind to a TV input,android.permission.BIND_TV_INPUT,,2,Yes,Allows the holder to bind to the top-level interface of a TV input. Should never be needed for normal apps.,"For apps running on Android TV, needs explanation",Protection level: signature|privileged
255,Other,Broadcast the call type/duration information,android.permission.BROADCAST_CALLLOG_INFO,,2,,null,need explanation - reason to broadcast,
256,Other,disable transmit indicator LED when camera is in use,android.permission.CAMERA_DISABLE_TRANSMIT_LED,,2,Yes,Allows a pre-installed system application to disable the camera use indicator LED.,need explanation - taking photos secretly,"to capture photos or record videos discreetly, without drawing attention to the camera's activity (ChatGPT)"
257,Other,Reserve space in the download cache,android.permission.DOWNLOAD_CACHE_NON_PURGEABLE,,2,,"Allows the app to download files to the download cache, which can't be automatically deleted when the download manager needs more space.","need explanation - ""persistent"" cache",
258,Other,Launch trust agent settings menu.,android.permission.LAUNCH_TRUST_AGENT_SETTINGS,,1,Yes,Allows an application to launch an activity that changes the trust agent behavior.,need explanation - manage trust agent,"Trusted agents are security-related components that provide features such as device lockdown, password management, or biometric authentication. provide a convenient way for users to access and configure the settings related to biometric authentication. Users can manage their biometric data, enable or disable biometric authentication methods, or set up additional security measures. (ChatGPT)"
259,Other,manage trusted credentials,android.permission.MANAGE_CA_CERTIFICATES,,3,Yes,Allows the app to install and uninstall CA certificates as trusted credentials.,need explanation - manage trust credentials,
260,Other,modify parental controls,android.permission.MODIFY_PARENTAL_CONTROLS,,3,Yes,Allows the holder to modify the system's parental controls data. Should never be needed for normal apps.,need explanation - parental control,
261,Other,Receive Android Beam transfer status,android.permission.NFC_HANDOVER_STATUS,,1,Yes,Allows this application to receive information about current Android Beam transfers,need explanation,
262,Other,verify packages,android.permission.PACKAGE_VERIFICATION_AGENT,,2,Yes,Allows the app to verify a package is installable.,"need explanation - security, cleaner, device management",allows an application to act as a package verification agent. The package verification agent is responsible for verifying the integrity and authenticity of installed packages on an Android device. (ChatGPT)
263,Other,directly start CDMA device setup,android.permission.PERFORM_CDMA_PROVISIONING,,2,Yes,Allows the app to start CDMA provisioning. Malicious apps may unnecessarily start CDMA provisioning.,need explanation - provide CDMA,CDMA provisioning typically involves configuring network settings and activating CDMA-based cellular services (ChatGPT)
264,Other,Register to handle the broadcasted call type/duration information,android.permission.PROCESS_CALLLOG_INFO,,1,,null,need explanation - process call log,
265,Other,receive Bluetooth messages (MAP),android.permission.RECEIVE_BLUETOOTH_MAP,,2,Yes,"Allows an application to monitor incoming Bluetooth MAP messages, to record or perform processing on them.",need explanation - Bluetooth MAP message,
266,Other,receive emergency broadcasts,android.permission.RECEIVE_EMERGENCY_BROADCAST,,1,Yes,Allows the app to receive and process emergency broadcast messages. This permission is only available to system apps.,"need explanation - emergency, alert",
267,Other,remove DRM certificates,android.permission.REMOVE_DRM_CERTIFICATES,,1,Yes,Allows an application to remove DRM certficates. Should never be needed for normal apps.,need explanation - DRM certificate management,
268,Other,access serial ports,android.permission.SERIAL_PORT,,1,Yes,Allows the holder to access serial ports using the SerialManager API.,"need explanation - connection, serial port",
269,Other,view Wi-Fi connections,android.permission.ACCESS_WIFI_STATE,,5,,"Allows the app to view information about Wi-Fi networking, such as whether Wi-Fi is enabled and name of connected Wi-Fi devices.",Apps perform real-time / online activities (check 2),
270,Other,access InputFlinger,android.permission.ACCESS_INPUT_FLINGER,,1,Yes,Allows the app to use InputFlinger low-level features.,need explanation - user input,"Input Flinger is a critical system service responsible for handling input events on an Android device, such as touch, keyboard, or sensor events. (ChatGPT)"
271,Other,access Bluetooth MAP data,android.permission.BLUETOOTH_MAP,,1,Yes,Allows the vehicle to send and receive SMS messages via a connected remote device.,need explanation - bluetooth messaging,"Hands-Free Messaging App; Bluetooth Message Access Profile (MAP). MAP enables the exchange of messages, such as SMS or email, between a Bluetooth-enabled device and a compatible device, such as a car's infotainment system. (ChatGPT)"
272,Other,manage app tokens,android.permission.MANAGE_APP_TOKENS,,10,Yes,"Allows the app to create and manage their own tokens, bypassing their normal Z-ordering. Should never be needed for normal apps.",need explanation - app management,"used by the Android system for managing and manipulating application windows and their behavior (ChatGPT)

When an app is installed, the system generates an app token for it. This token is stored in the app's manifest file. When the app is launched, the system uses the app token to identify the app and to grant it the permissions that it has been granted.
App tokens are also used to identify apps to other apps. For example, when an app wants to share data with another app, it can use the other app's app token to identify it.
App tokens are an important part of the Android security model. They help to ensure that only authorized apps can access data and that data is shared only with authorized apps. (Google-PaLM)"
273,Other,bind to a dream service,android.permission.BIND_DREAM_SERVICE,,2,Yes,Allows the holder to bind to the top-level interface of a dream service. Should never be needed for normal apps.,need explanation - screensaver,"Protection level: signature
DreamService is responsible for implementing screensavers or interactive daydreams on an Android device. With this permission, the app can implement a DreamService that defines the behavior and appearance of the screensaver. (ChatGPT)"
274,Other,permanently disable device,android.permission.BRICK,,1,Yes,Allows the app to disable the entire tablet permanently. This is very dangerous.,need explanation - device management,System app only
275,Other,run in factory test mode,android.permission.FACTORY_TEST,,7,Yes,"Run as a low-level manufacturer test, allowing complete access to the tablet hardware. Only available when a tablet is running in manufacturer test mode.",need explanation - device testing; troubleshooting,"Not for use by third-party applications.
typically used during the manufacturing or testing process of Android devices; verify the functionality of various hardware components, conduct quality assurance checks, and ensure that the device meets specified standards (ChatGPT)"
276,Other,change pointer speed,android.permission.SET_POINTER_SPEED,,1,Yes,Allows the app to change the mouse or trackpad pointer speed at any time. Should never be needed for normal apps.,"need explanation - user interface, pointer",Pointer speed refers to the sensitivity or responsiveness of the device's touch or mouse input (ChatGPT)
277,Other,grant or revoke permissions,android.permission.GRANT_REVOKE_PERMISSIONS,,2,,Allows an application to grant or revoke specific permissions for it or other applications. Malicious applications may use this to access features you have not granted them.,need explanation - device / app management,
278,Other,read sensitive log data,android.permission.READ_LOGS,,2,Yes,"Allows the app to read from the system\'s various log files. This allows it to discover general information about what you are doing with the phone, potentially including personal or private information.","need explanation - debug, troubleshoot, device management","Not for use by third-party applications.
Debugging and Troubleshooting Apps; System logs contain various types of information, including debugging messages, error logs, and runtime information generated by the operating system and apps running on the device. (ChatGPT)"
279,Other,control Wifi displays,android.permission.CONTROL_WIFI_DISPLAY,,3,Yes,Allows the app to control low-level features of Wifi displays.,need explanation - WiFi display management,
280,Other,start print service configuration activities,android.permission.START_PRINT_SERVICE_CONFIG_ACTIVITY,,1,,Allows the holder to start the configuration activities of a print service. Should never be needed for normal apps.,need explanation - printer setup,
281,Other,Google Maps,com.google.android.googleapps.permission.GOOGLE_AUTH.local,,21,,Allows apps to sign in to Google Maps using the account(s) stored on this Android device.,ok for Google apps; others need explanation - google map,
282,Other,approximate location (network-based),android.permission.ACCESS_COARSE_LOCATION,,15,,Allows the app to get your approximate location. This location is derived by location services using network location sources such as cell towers and Wi-Fi. These location services must be turned on and available to your device for the app to use them. Apps may use this to determine approximately where you are.,"Need to specify clearly - location, nearby (check 15)",
283,Other,AdSense,com.google.android.googleapps.permission.GOOGLE_AUTH.adsense,,19,,Allows apps to sign in to Google AdSense using the account(s) stored on this Android device.,ok for Google apps; others need explanation,"Apart from the Google app, also needed by cloner for account access?"
284,Other,AdWords,com.google.android.googleapps.permission.GOOGLE_AUTH.adwords,,19,,Allows apps to sign in to Google AdWords using the account(s) stored on this Android device.,ok for Google apps; others need explanation,"Apart from the Google app, also needed by cloner for account access?"
285,Other,Google App Engine,com.google.android.googleapps.permission.GOOGLE_AUTH.ah,,19,,Allows apps to sign in to Google App Engine using the account(s) stored on this Android device.,ok for Google apps; others need explanation,"Apart from the Google app, also needed by cloner for account access?"
286,Other,Blogger,com.google.android.googleapps.permission.GOOGLE_AUTH.blogger,,19,,Allows apps to sign in to Blogger using the account(s) stored on this Android device.,ok for Google apps; others need explanation,"Apart from the Google app, also needed by cloner for account access?"
287,Other,Google Calendar,com.google.android.googleapps.permission.GOOGLE_AUTH.cl,,19,,Allows apps to sign in to Google Calendar using the account(s) stored on this Android device.,ok for Google apps; others need explanation,"Apart from the Google app, also needed by cloner for account access?"
288,Other,Dodgeball,com.google.android.googleapps.permission.GOOGLE_AUTH.dodgeball,,19,,Allows apps to sign in to Dodgeball using the account(s) stored on this Android device.,ok for Google apps; others need explanation,"Apart from the Google app, also needed by cloner for account access?"
289,Other,Google Finance,com.google.android.googleapps.permission.GOOGLE_AUTH.finance,,19,,Allows apps to sign in to Google Finance using the account(s) stored on this Android device.,ok for Google apps; others need explanation,"Apart from the Google app, also needed by cloner for account access?"
290,Other,Google Base,com.google.android.googleapps.permission.GOOGLE_AUTH.gbase,,19,,Allows apps to sign in to Google Base using the account(s) stored on this Android device.,ok for Google apps; others need explanation,"Apart from the Google app, also needed by cloner for account access?"
291,Other,Google Voice,com.google.android.googleapps.permission.GOOGLE_AUTH.grandcentral,,19,,Allows apps to sign in to Google Voice using the account(s) stored on this Android device.,ok for Google apps; others need explanation,"Apart from the Google app, also needed by cloner for account access?"
292,Other,Google Groups,com.google.android.googleapps.permission.GOOGLE_AUTH.groups2,,19,,Allows apps to sign in to Google Groups using the account(s) stored on this Android device,ok for Google apps; others need explanation,"Apart from the Google app, also needed by cloner for account access?"
293,Other,Google Health,com.google.android.googleapps.permission.GOOGLE_AUTH.health,,19,,Allows apps to sign in to Google Health using the account(s) stored on this Android device.,ok for Google apps; others need explanation,"Apart from the Google app, also needed by cloner for account access?"
294,Other,iGoogle accounts,com.google.android.googleapps.permission.GOOGLE_AUTH.ig,,19,,Allows apps to sign in to iGoogle using the account(s) stored on this Android device.,ok for Google apps; others need explanation,"Apart from the Google app, also needed by cloner for account access?"
295,Other,JotSpot,com.google.android.googleapps.permission.GOOGLE_AUTH.jotspot,,19,,Allows apps to sign in to JotSpot using the account(s) stored on this Android device.,ok for Google apps; others need explanation,"Apart from the Google app, also needed by cloner for account access?"
296,Other,Knol,com.google.android.googleapps.permission.GOOGLE_AUTH.knol,,19,,Allows apps to sign in to Knol using the account(s) stored on this Android device.,ok for Google apps; others need explanation,"Apart from the Google app, also needed by cloner for account access?"
297,Other,Picasa Web Albums,com.google.android.googleapps.permission.GOOGLE_AUTH.lh2,,19,,Allows apps to sign in to Picasa Web Albums using the account(s) stored on this Android device.,ok for Google apps; others need explanation,"Apart from the Google app, also needed by cloner for account access?"
298,Other,Google mobile apps,com.google.android.googleapps.permission.GOOGLE_AUTH.mobile,,19,,Allows apps to sign in to Google mobile apps using the account(s) stored on this Android device.,ok for Google apps; others need explanation,"Apart from the Google app, also needed by cloner for account access?"
299,Other,Google News,com.google.android.googleapps.permission.GOOGLE_AUTH.news,,19,,Allows apps to sign in to Google News using the account(s) stored on this Android device.,ok for Google apps; others need explanation,"Apart from the Google app, also needed by cloner for account access?"
300,Other,Google Notebook,com.google.android.googleapps.permission.GOOGLE_AUTH.notebook,,19,,Allows apps to sign in to Google Notebook using the account(s) stored on this Android device.,ok for Google apps; others need explanation,"Apart from the Google app, also needed by cloner for account access?"
301,Other,Orkut,com.google.android.googleapps.permission.GOOGLE_AUTH.orkut,,19,,Allows apps to sign in to Orkut using the account(s) stored on this Android device.,ok for Google apps; others need explanation,"Apart from the Google app, also needed by cloner for account access?"
302,Other,Google Book Search,com.google.android.googleapps.permission.GOOGLE_AUTH.print,,19,,Allows apps to sign in to Google Book Search using the account(s) stored on this Android device.,ok for Google apps; others need explanation,"Apart from the Google app, also needed by cloner for account access?"
303,Other,Google Webmaster Tools,com.google.android.googleapps.permission.GOOGLE_AUTH.sitemaps,,19,,Allows apps to sign in to Google Webmaster Tools using the account(s) stored on this Android device.,ok for Google apps; others need explanation,"Apart from the Google app, also needed by cloner for account access?"
304,Other,Google Voice Search,com.google.android.googleapps.permission.GOOGLE_AUTH.speech,,19,,Allows apps to sign in to Google Voice Search using the account(s) stored on this Android device.,ok for Google apps; others need explanation,"Apart from the Google app, also needed by cloner for account access?"
305,Other,Personalized Speech Recognition,com.google.android.googleapps.permission.GOOGLE_AUTH.speechpersonalization,,19,,Allows apps to sign in to the Personalized Speech Recognition service using the account(s) stored on this Android device.,ok for Google apps; others need explanation,"Apart from the Google app, also needed by cloner for account access?"
306,Other,Google Talk,com.google.android.googleapps.permission.GOOGLE_AUTH.talk,,19,,Allows apps to sign in to Google Talk using the account(s) stored on this Android device.,ok for Google apps; others need explanation,"Apart from the Google app, also needed by cloner for account access?"
307,Other,Google Wi-Fi,com.google.android.googleapps.permission.GOOGLE_AUTH.wifi,,19,,Allows apps to sign in to Google Wi-Fi using the account(s) stored on this Android device.,ok for Google apps; others need explanation,"Apart from the Google app, also needed by cloner for account access?"
308,Other,access content providers externally,android.permission.ACCESS_CONTENT_PROVIDERS_EXTERNALLY,,4,Yes,Allows the holder to access content providers from the shell. Should never be needed for normal apps.,need explanation - access content providers,"This permission is required if an application wants to access content providers from outside of its own process, such as to access a content provider from another application or to access a content provider from a different user. (Google-PaLM)"
309,Other,get information on internal storage,android.permission.ASEC_ACCESS,,1,Yes,Allows the app to get information on internal storage.,need explanation - large storage needed,"https://android.stackexchange.com/questions/155565/what-does-mnt-asec-directory-contain
ASEC (Android Secure External Cache) - implemented in a time when Android devices come with limited storage and has to resort to external storage (i.e. SD card) for apps, and its purpose is to securely store part of the apps so as to prevent corruption and piracy by copying SD card contents.
From Wikipedia: Applications moved to an SD card use an ASEC extension. These files can then be found under the .android_secure folder on the SD card. If an application must be moved from memory back to its device’s local storage, the file is decrypted from the ASEC file format to a basic APK (Android Package) file format.
To achieve ""Move to SD card"" feature.
Also used in Android 4.1 as ""Forward Locking"" (to protect paid apps not to be copied and shared)
However, ASEC container management (creating, deleting, mounting, and unmounting) is (should be) implemented in the system volume daemon (vold)"
310,Other,create internal storage,android.permission.ASEC_CREATE,,1,Yes,Allows the app to create internal storage.,need explanation - large storage needed,same as 309
