45,Contacts,read your contacts,android.permission.READ_CONTACTS,,18030,,"Allows the app to read data about your contacts stored on your phone, including the frequency with which you\'ve called, emailed, or communicated in other ways with specific individuals. This permission allows apps to save your contact data, and malicious apps may share contact data without your knowledge.","Need to specify ""contact list""",
46,Other,modify battery statistics,android.permission.UPDATE_DEVICE_STATS,,80,Yes,Allows the app to modify collected battery statistics. Not for use by normal apps.,Need explanation - battery,"Not for use by third-party applications.
Apps for privacy enhancement"
47,Photos/Media/Files,access USB storage filesystem,android.permission.MOUNT_UNMOUNT_FILESYSTEMS,,2810,Yes,Allows the app to mount and unmount filesystems for removable storage.,Need explanation,"Not for use by third-party applications; ignored for 3rd party apps; only granted if it is an app for the phone manufacturer and is clearly explained
Notice that MOUNT_UNMOUNT_FILESYSTEM permission is ignored for 3rd party apps, so (unless you work for e.g. Samsung or Xiaomi) you can safely delete this permission from your manifest.
(https://stackoverflow.com/questions/54694818/where-can-i-find-more-info-about-android-specific-permissions)"
48,Other,set an alarm,com.android.alarm.permission.SET_ALARM,,3628,,Allows the app to set an alarm in an installed alarm clock app. Some alarm clock apps may not implement this feature.,"Need explanation - calendar-like, virtual personal assistant",
49,Other,reorder running apps,android.permission.REORDER_TASKS,,3151,,Allows the app to move tasks to the foreground and background. The app may do this without your input.,Need explanation,"For task management, need explanation
MoveTaskToFront will require this permission 
(ref:https://learn.microsoft.com/en-us/dotnet/api/android.app.activitymanager.movetasktofront?view=xamarin-android-sdk-13)"
50,Other,permission to install a location provider,android.permission.INSTALL_LOCATION_PROVIDER,,31,Yes,Create mock location sources for testing or install a new location provider. This allows the app to override the location and/or status returned by other location sources such as GPS or location providers.,Need explanation - location,"Not for use by third-party applications.
VPN; privacy enhancement"
51,Other,change screen orientation,android.permission.SET_ORIENTATION,,117,Yes,Allows the app to change the rotation of the screen at any time. Should never be needed for normal apps.,Need explanation - orientation,"Needs explanation, not necessary for normal apps - they can set orientation without this permission
Some device configurations can change while the app is running. These include, but aren't limited to:
App display size
Screen orientation
Font size and weight
Locale
Dark mode versus light mode
Keyboard availability
The user of an app expects state to be preserved. If a user is filling out a form and opens another app in multi-window mode to reference information, it is a bad user experience if they return to a cleared form or to somewhere else in the app entirely. As a developer, you must provide a consistent user experience through configuration changes and activity recreation.
To verify whether state is preserved in your application, you can perform actions that cause configuration changes both while the app is in the foreground and while it is in the background. These actions include:
Rotating the device
(ref:https://developer.android.com/guide/topics/resources/runtime-changes)"
52,Other,control Near Field Communication,android.permission.NFC,,4175,,"Allows the app to communicate with Near Field Communication (NFC) tags, cards, and readers.","Need explanation - specify ""NFC""",
53,Other,Modify Google service configuration,com.google.android.providers.gsf.permission.WRITE_GSERVICES,,147,,Allow the app to access the Google Services Framework database and write data,Google / android / manufacturer - providing a Google service; others need explanation,"Similar to 26, this permission allows update of Google services available on a device, and is ""protected by the system protection level (meaning, it's only granted to ""system apps"")""
Only allowed to system / Google apps
For Google Services Framework to write the data,it is responsible for communicate between device and google serivce "
54,Other,expand/collapse status bar,android.permission.EXPAND_STATUS_BAR,,1185,,Allows the app to expand or collapse the status bar.,Need explanation - use or control the status bar,"Prompt user to change settings in the status bar? Provide information when running in background?
Hidden the application and display it as a icon
(ref:https://www.jianshu.com/p/baeed5eff82a)
""??????????????????Allows an application to open, close, or disable the status bar and its icons."""
55,Other,read the contents of your USB storage,android.permission.READ_EXTERNAL_STORAGE,,109,,Allows the app to test a permission for the SD card that will be available on future devices.,"All ok with reasonable description  - *** the description should be about the app, not the company itself","On devices that run Android 10 or higher, you don't need storage-related permissions to access and modify media files that your app owns; but needed for devices that run Android 9 (API level 28) or lower (ref:https://developer.android.com/training/data-storage/shared/media#storage-permission). Allow if an app needs to read / write anything then (for backward-compatibility).
Refer to permission 3  -6 "
56,Other,modify or delete the contents of your USB storage,android.permission.WRITE_EXTERNAL_STORAGE,,63,,Allows the app to write to the SD card.,"All ok with reasonable description - *** the description should be about the app, not the company itself","On devices that run Android 10 or higher, you don't need storage-related permissions to access and modify media files that your app owns; but needed for devices that run Android 9 (API level 28) or lower (ref:https://developer.android.com/training/data-storage/shared/media#storage-permission). Allow if an app needs to read / write anything then (for backward-compatibility).
Refer to permission 3  -6 "
57,Other,control flashlight,android.permission.FLASHLIGHT,,9271,,Allows the app to control the flashlight.,"Need explanation - specify ""flashlight"", ""camera""",
58,Other,adjust your wallpaper size,android.permission.SET_WALLPAPER_HINTS,,2099,,Allows the app to set the system wallpaper size hints.,"Need explanation - specify ""wallpaper""",
59,Other,set wallpaper,android.permission.SET_WALLPAPER,,6390,,Allows the app to set the system wallpaper.,"Need explanation - specify ""wallpaper""",
60,Other,delete other apps' caches,android.permission.DELETE_CACHE_FILES,,174,Yes,Allows the app to delete cache files.,Cleaner; others - need explanation,"Protection level: signature|privileged
Cleaner? - to free up storage space"
61,Other,uninstall shortcuts,com.android.launcher.permission.UNINSTALL_SHORTCUT,,1238,,Allows the app to remove shortcuts without user intervention.,Need explanation,"""This permission is no longer supported."" (ref:https://developer.android.com/reference/android/Manifest.permission#UNINSTALL_SHORTCUT)
Can remove others' shortcut too, so for privacy / security / system apps
(ref:https://stackoverflow.com/questions/3480287/trying-to-uninstall-shortcut-but-shortcut-wont-go-away)"
62,Other,create accounts and set passwords,android.permission.AUTHENTICATE_ACCOUNTS,,3288,,"Allows the app to use the account authenticator capabilities of the AccountManager, including creating accounts and getting and setting their passwords.","All ok with reasonable description (Check 16, 38, 39)","(ref:https://android.stackexchange.com/questions/44293/what-does-permission-manage-accounts-mean)
A suggested way to manage login/credentials (https://developer.android.com/training/id-auth/identify)
Related to Account Manager.Ususally requireed before Andriod 22
(https://developer.android.com/reference/android/accounts/AccountManager)"
63,Other,full license to interact across users,android.permission.INTERACT_ACROSS_USERS_FULL,,525,Yes,Allows all possible interactions across users.,Need explanation - interact across users,"Interaction across users on the same device; probably needs explanation
Class for handling cross profile operations. Apps can use this class to interact with its instance in any profile that is in getTargetUserProfiles(). For example, app can use this class to start its main activity in managed profile.
android.Manifest.permission#INTERACT_ACROSS_USERS_FULL permission. Both the caller and target user profiles must be in the same profile group. The target user must be a valid user returned from getTargetUserProfiles().
(ref:https://developer.android.com/reference/android/content/pm/CrossProfileApps)"
64,Other,measure app storage space,android.permission.GET_PACKAGE_SIZE,,821,,"Allows the app to retrieve its code, data, and cache sizes","OK for cleaner, file manager, backup / restore
Others: need explanation","Allows an application to find out the space used by any package. (https://developer.android.com/reference/android/Manifest.permission#GET_PACKAGE_SIZE) - not only its own but also others 
- useful to cleaner and file manager (what about anti-virus-like apps?), backup and restore"
65,Other,run the application's scheduled background work,android.permission.BIND_JOB_SERVICE,,114,Yes,Allows the Android system to run the application in the background when requested.,"All ok with reasonable description  - *** the description should be about the app, not the company itself",
66,Cellular data settings,change/intercept network settings and traffic,android.permission.WRITE_APN_SETTINGS,,126,Yes,"Allows the app to change network settings and to intercept and inspect all network traffic, for example to change the proxy and port of any APN. Malicious apps may monitor, redirect, or modify network packets without your knowledge.",Android / Google / Manufacturer - setting / backup / recovery,"Not for use by third-party applications.
Need explanation, probably apps by Telco, backup/recovery apps, anti-virus-like apps"
67,Other,directly install apps,android.permission.INSTALL_PACKAGES,,239,Yes,Allows the app to install new or updated Android packages. Malicious apps may use this to add new apps with arbitrarily powerful permissions.,Play store / manufacturer's file manager; check description for explanation,"Not for use by third-party applications.
Need explanation"
68,Other,power device on or off,android.permission.DEVICE_POWER,,277,Yes,Allows the app to turn the phone on or off.,Need explanation - alarm (to power on),
69,Other,send package removed broadcast,android.permission.BROADCAST_PACKAGE_REMOVED,,30,Yes,Allows the app to broadcast a notification that an app package has been removed. Malicious apps may use this to kill any other running app.,Need explanation,"Not for use by third-party applications.
Cleaner and Anti-virus-like apps?"
70,Location,access extra location provider commands,android.permission.ACCESS_LOCATION_EXTRA_COMMANDS,,2365,,Allows the app to access extra location provider commands. This may allow the app to to interfere with the operation of the GPS or other location sources.,Privacy / VPN - location-specific; or with explanation,
71,Other,retrieve details of running apps,android.permission.GET_DETAILED_TASKS,,23,Yes,Allows the app to retrieve detailed information about currently and recently running tasks. Malicious apps may discover private information about other apps.,"System, cleaner and Anti-virus-like apps - with explanation",
72,Wearable sensors/Activity data,body sensors (like heart rate monitors),android.permission.BODY_SENSORS,,1331,,"Allows an application to access data from sensors that the user uses to measure what is happening inside their body, such as heart rate.",Need explanation,
73,Other,interact across users,android.permission.INTERACT_ACROSS_USERS,,263,Yes,Allows the app to perform actions across different users on the device. Malicious apps may use this to violate the protection between users.,Check 63,"Interaction across users on the same device; probably needs explanation
Communicate with components in your own app: (INTERACT_ACROSS_USERS) Or with components in other apps: (INTERACT_ACROSS_USERS_FULL)
(ref:https://source.android.com/docs/devices/admin/multiuser-apps)"
74,Other,read terms you added to the dictionary,android.permission.READ_USER_DICTIONARY,,310,,"Allows the app to read all words, names and phrases that the user may have stored in the user dictionary.","Virtual personal assistant, input methods; or with explanation",
75,Other,update component usage statistics,android.permission.PACKAGE_USAGE_STATS,,1670,Yes,Allows the app to modify collected component usage statistics. Not for use by normal apps.,Need explanation - update statistics,"Protection level: signature|privileged|development|appop|retailDemo
Privacy; security
Provides access to device usage history and statistics. Usage data is aggregated into time intervals: days, weeks, months, and years.
Most methods on this API require the permission android.permission.PACKAGE_USAGE_STATS.
https://developer.android.com/reference/android/app/usage/UsageStatsManager"
76,Identity,read your own contact card,android.permission.READ_PROFILE,,1661,,"Allows the app to read personal profile information stored on your device, such as your name and contact information. This means the app can identify you and may send your profile information to others.",Need explanation - e.g. social media,"In-app login using Gmail does not require the android.permission.READ_PROFILE permission.

The READ_PROFILE permission is typically used to access a user's profile information, such as their name, email address, or profile picture. However, when implementing in-app login using Gmail, the required permissions are related to authentication and accessing user account information.

To implement Gmail login in an app, you would typically use the Google Sign-In API, which requires the com.google.android.gms.auth.api.signin package and appropriate authentication scopes. The specific permissions required for Gmail login are related to accessing the user's email address and basic profile information, such as android.permission.GET_ACCOUNTS and android.permission.GET_PROFILE.


In-app purchases with Google Pay do not require the android.permission.READ_PROFILE permission.

The READ_PROFILE permission is typically used to access a user's profile information, such as their name, email address, or profile picture. It is not directly related to in-app purchases or payment processing.

When integrating Google Pay for in-app purchases, the relevant permissions are related to payment processing and are typically managed through the Google Play Billing Library. These permissions include com.android.vending.BILLING or com.android.vending.IN_APP_PURCHASE_BILLING.

***
com.android.vending.BILLING is no longer necessary for in-app purchases. The new Google Play Billing Library provides a unified API for in-app purchases on both Android and iOS."
77,Other,Access download manager.,android.permission.ACCESS_DOWNLOAD_MANAGER,,864,,Allows the app to access the download manager and to use it to download files. Malicious apps can use this to disrupt downloads and access private information.,Need explanation - related to download,"Cleaner; file manager; anti-virus-like apps; or with explanation
Allow to use Download Manager 
The download manager is a system service that handles long-running HTTP downloads
https://developer.android.com/reference/android/app/DownloadManager

The ACCESS_DOWNLOAD_MANAGER permission is used to allow an application to access the download manager. This permission is required if an application wants to access the download manager to query the status of downloads, start or stop downloads, or delete downloads. (Google-PaLM)

The ACCESS_DOWNLOAD_MANAGER permission is not necessary to load a file from online sources in an app."
78,Other,mock location sources for testing,android.permission.ACCESS_MOCK_LOCATION,,765,Yes,Create mock location sources for testing or install a new location provider. This allows the app to override the location and/or status returned by other location sources such as GPS or location providers.,"Privacy, VPN - need to mention location-specific; or with explanation",
79,Other,modify/delete internal media storage contents,android.permission.WRITE_MEDIA_STORAGE,,378,Yes,Allows the app to modify the contents of the internal media storage.,"Similar to 3-6
(Necessary for app to write media to ""outside"" location)",
80,Calendar,add or modify calendar events and send email to guests without owners' knowledge,android.permission.WRITE_CALENDAR,,11650,,"Allows the app to add, remove, change events that you can modify on your phone, including those of friends or co-workers. This may allow the app to send messages that appear to come from calendar owners, or modify events without the owners\' knowledge.",Calendar; virtual personal assistant; others - need explanation,
81,Calendar,read calendar events plus confidential information,android.permission.READ_CALENDAR,,11541,,"Allows the app to read all calendar events stored on your phone, including those of friends or co-workers. This may allow the app to share or save your calendar data, regardless of confidentiality or sensitivity.",Calendar; virtual personal assistant; others - need explanation,
82,Other,Broadcast data messages to apps.,com.google.android.permission.BROADCAST_DATA_MESSAGE,com.google.android.c2dm.permission.SEND,115,,Can broadcast data messages received from the Internet to apps registered to listen for them.,Need explanation,"The com.google.android.permission.BROADCAST_DATA_MESSAGE permission is used to allow an application to broadcast data messages to other applications. This permission is required if an application wants to send data messages to other applications, such as sending a message to another application to update its UI. (Google-PaLM)"
83,Other,disable or modify status bar,android.permission.STATUS_BAR,,86,Yes,Allows the app to disable the status bar or add and remove system icons.,need explanation,"Not for use by third-party applications

A theme app typically needs the android.permission.STATUS_BAR permission to modify or customize the appearance of the status bar in Android."
84,Other,control media playback and metadata access,android.permission.ALLOW_ANY_CODEC_FOR_PLAYBACK,,501,Yes,Allows the app to use any installed media decoder to decode for playback.,"Media player, game, streaming, social media, web browser - ok without explanation; apps that need to play media - need to mention","for regular music playback, apps typically rely on standard audio codecs that are supported by the device and the media framework. These codecs are generally accessible without the need for the ALLOW_ANY_CODEC_FOR_PLAYBACK permission."
85,Other,read sync settings,android.permission.READ_SYNC_SETTINGS,,1951,,"Allows the app to read the sync settings for an account. For example, this can determine whether the People app is synced with an account.","need explanation - e.g., account management, file management, contact management","apps that utilize synchronization capabilities; apps that monitor or report features related to synchronization activities; need explanation
mainly use for management app like, account management, file management, contact management
https://developer.android.com/training/sync-adapters"
86,Other,toggle sync on and off,android.permission.WRITE_SYNC_SETTINGS,,2293,,"Allows an app to modify the sync settings for an account. For example, this can be used to enable sync of the People app with an account.","need explanation - e.g., account management, file management, contact management","Control sync adapter settings, similar to read sync settings
https://developer.android.com/training/sync-adapters/running-sync-adapter"
87,Phone,directly call phone numbers,android.permission.CALL_PHONE,,13454,,Allows the app to call phone numbers without your intervention. This may result in unexpected charges or calls. Note that this doesn\'t allow the app to call emergency numbers. Malicious apps may cost you money by making calls without your confirmation.,"Need explanation - e.g., Safety app; security app - call someone for emergency",
88,Other,access the cache filesystem,android.permission.ACCESS_CACHE_FILESYSTEM,,62,Yes,Allows the app to read and write the cache filesystem.,need explanation - cache,"Protection Level: signature|system
Applications that have the ACCESS_CACHE_FILESYSTEM permission can access the cache filesystem to read or write cache files. This can be useful for applications that need to store temporary data or that need to access data that is frequently accessed. (Google-PaLM)"
89,Other,write Home settings and shortcuts,com.android.launcher.permission.WRITE_SETTINGS,,467,,Allows the app to change the settings and shortcuts in Home.,Check 43,"use for an application to create or delete shortcuts, includes the ability to change the order of the apps on the home screen, add or remove widgets, and change the wallpaper.
https://base.hjq.komect.com/ReadmeText/userAuthList.html"
90,Other,bind to a VPN service,android.permission.BIND_VPN_SERVICE,,9,Yes,Allows the holder to bind to the top-level interface of a Vpn service. Should never be needed for normal apps.,"need explanation - VPN management and configuration, VPN connection creation","Protection level: signature
VPN; privacy enhancement
VpnService is a base class for applications to extend and build their own VPN solutions. In general, it creates a virtual network interface, configures addresses and routing rules, and returns a file descriptor to the application. Each read from the descriptor retrieves an outgoing packet which was routed to the interface. Each write to the descriptor injects an incoming packet just like it was received from the interface
Services extending this class need to be declared with an appropriate permission and intent filter. Their access must be secured by Manifest.permission.BIND_VPN_SERVICE permission, and their intent filter must match SERVICE_INTERFACE action. Here is an example of declaring a VPN service in AndroidManifest.xml:
https://developer.android.com/reference/android/net/VpnService
To add a VPN service to your app, create an Android service inheriting from VpnService. Declare the VPN service in your app manifest file with the following additions:
Protect the service with the BIND_VPN_SERVICE permission so that only the system can bind to your service.
Advertise the service with the ""android.net.VpnService"" intent filter so that the system can find your service.
https://developer.android.com/guide/topics/connectivity/vpn"
91,Other,retrieve running apps,android.permission.GET_TASKS,,143,,Allows the app to retrieve information about currently and recently running tasks. This may allow the app to discover information about which applications are used on the device.,same as 1,
92,Other,enable app debugging,android.permission.SET_DEBUG_APP,,197,Yes,Allows the app to turn on debugging for another app. Malicious apps may use this to kill other apps.,need explanation - debug / check other apps,"Not for use by third-party applications.
security - check other apps; system app - other apps; others - need explanation
Generally,it is used in development
https://blog.csdn.net/BLUESKYHOST/article/details/113478390"
93,Other,manage users,android.permission.MANAGE_USERS,,133,Yes,"Allows apps to manage users on the device, including query, creation and deletion.",need explanation - manage user,"System app; security; cleaner; need explanation
Manages users and user details on a multi-user system. There are two major categories of users: fully customizable users with their own login, and profiles that share a workspace with a related use
https://developer.android.com/reference/android/os/UserManager

Apart from device management, parental control apps may also need this."
94,Device & app history,read your Web bookmarks and history,com.android.browser.permission.READ_HISTORY_BOOKMARKS,,577,,"Allows the app to read the history of all URLs that the Browser has visited, and all of the Browser\'s bookmarks. Note: this permission may not be enforced by third-party browsers or other applications with web browsing capabilities.","Need explanation - even for social media, shopping, news, search engine - bookmark / history","These data include visited URLs, favorite web pages, added bookmarks, and other information.
https://juejin.cn/s/com.android.browser.permission.read_history_bookmarks"
95,Other,write web bookmarks and history,com.android.browser.permission.WRITE_HISTORY_BOOKMARKS,,284,,Allows the app to modify the Browser\'s history or bookmarks stored on your phone. This may allow the app to erase or modify Browser data. Note: this permission may note be enforced by third-party browsers or other applications with web browsing capabilities.,Browser and its extension - ok; others: need explanation,This permission is typically used by browser extensions and other apps that want to add their own bookmarks to the browser.
96,Device & app history,retrieve system internal state,android.permission.DUMP,,130,Yes,Allows the app to retrieve internal state of the system. Malicious apps may retrieve a wide variety of private and secure information that they should never normally need.,"System app, manufacturer's security / backup apps; others: need explanation","Not for use by third-party applications.
Privacy / security app? System app?

an app does not need to check android.permission.DUMP to obtain device-unique identification information (Google PaLM)"
